{"v":1,"id":"fedcba9876543210","title":"Payment received","body":"120 € from ACME","tag":"payment-42","silent":false,"requireInteraction":true,"renotify":true,"icon":"/static/icon-192.png","badge":"/static/badge-96.png","actions":[{"action":"ack","title":"Acknowledge","type":"post","url":"https://app.example.com/alerts/42/ack?signature=abc"},{"action":"open","title":"Open","type":"navigate","url":"/app/payments/42"}],"data":{"paymentId":42,"currency":"EUR"},"click":"/app/payments/42","badgeCount":3}
